{
  "schema": "hebrinex.project_catalog_entry",
  "schema_version": 1,
  "project_id": "PRJ-00000000000000000000000000000000",
  "instance_id": "INST-00000000000000000000000000000000",
  "project_root": "<absolute-project-root>",
  "binding_schema_version": 1,
  "state": "active",
  "observed_at": "1970-01-01T00:00:00.0000000Z",
  "source": "validated_binding"
}
